,date,image_link,link,summary,title,article_id
978,"Sep 21, 2018 at 12:21 ",https://d32r1sh890xpii.cloudfront.net/article/270x200/cfe11bc4ddd2b2e934e210a6964de78c.jpg,https://oilprice.com/Energy/Energy-General/Oil-Prices-Rise-As-Rig-Count-Sees-Minor-Dip.html,"Baker Hughes reported a loss of two rigs in the United States this week, bringing the total number of active oil and gas rigs to 1,053 according to the report,…",Oil Prices Rise As Rig Count Sees Minor Dip,978
979,"Sep 21, 2018 at 10:53 ",https://d32r1sh890xpii.cloudfront.net/article/270x200/fd2da6c9d7b174f438f991f9e8b1ca13.jpg,https://oilprice.com/Energy/Energy-General/Indias-State-Refiners-May-Hedge-Oil-Futures-Amid-Currency-Rout.html,India plans to ask its state-held oil refiners to lock in the price of their crude oil futures purchases amid a sliding local currency and expectations of higher oil prices…,India’s State Refiners May Hedge Oil Futures Amid Currency Rout,979
980,"Sep 21, 2018 at 07:44 ",https://d32r1sh890xpii.cloudfront.net/article/270x200/3b37c326492ed17f98fb80016bff14fc.jpg,https://oilprice.com/Energy/Energy-General/Iran-Starts-Air-Force-Drills-Near-The-Worlds-Crucial-Oil-Chokepoint.html,"Iran’s Air Force and the Islamic Revolution Guards Corps began on Friday fighter jet drills over the waters near the world’s most important oil chokepoint, the Strait of Hormuz,…",Iran Starts Air Force Drills Near The World’s Crucial Oil Chokepoint,980
981,"Sep 20, 2018 at 16:18 ",https://d32r1sh890xpii.cloudfront.net/article/270x200/911fcb2f3cdb01de5ef3c6b6ed976e6a.jpg,https://oilprice.com/Energy/Crude-Oil/Iran-We-Wont-Let-OPEC-Boost-Production.html,"It’s about that time again. WTI hits $70 per barrel and the tweet-rage is back.

We protect the countries of the Middle East, they would…",Iran: We Won’t Let OPEC Boost Production,981
982,"Sep 20, 2018 at 16:11 ",https://d32r1sh890xpii.cloudfront.net/article/270x200/86a5dd6861fa9cf5e2141f12ab1b6fff.jpg,https://oilprice.com/Energy/Energy-General/Investors-Back-Brent-To-Break-80.html,"For more than a week, Brent Crude prices have been flirting with the $80 threshold as market participants have focused on the shrinking oil supply from Iran and continuous…",Investors Back Brent To Break $80,982
983,"Sep 20, 2018 at 15:59 ",https://d32r1sh890xpii.cloudfront.net/article/270x200/29b93f2a6497ef1695542f7078f53b10.jpg,https://oilprice.com/Energy/Crude-Oil/Canada-Boosts-Oil-Exports-To-The-US.html,"Canada is requiring stronger tanks cars for transporting crude oil ahead of previously set deadlines, the country’s transport minister said on Wednesday.
Transport Canada, the government department responsible for…",Canada Boosts Oil Exports To The U.S.,983
984,"Sep 20, 2018 at 13:54 ",https://d32r1sh890xpii.cloudfront.net/article/270x200/8352c06591de0190999ee6a8e54de7da.jpg,https://oilprice.com/Energy/Energy-General/More-US-Sanctions-On-Russia-Would-Be-Counter-Productive.html,"Hoping to push back against Russia and prevent president Trump from changing current policy, the Senate has produced two new sanctions bills: the Defending Elections from Threats by Establishing Redlines…",More U.S. Sanctions On Russia Would Be Counter Productive,984
985,"Sep 20, 2018 at 13:24 ",https://d32r1sh890xpii.cloudfront.net/article/270x200/ccf88e559249601766108268482845a2.jpg,https://oilprice.com/Energy/Natural-Gas/Will-Canadas-30-Billion-Megaproject-Be-Approved.html,"Oilfield service providers suffered the heaviest blows from the 2014 oil price meltdown—there is little question about that. And the situation was particularly grave in Canada, and continues to be…",Will Canada’s $30 Billion Megaproject Be Approved?,985
986,"Sep 20, 2018 at 13:03 ",https://d32r1sh890xpii.cloudfront.net/article/270x200/0b1072bd742290c0899936c7fed977fa.jpg,https://oilprice.com/Alternative-Energy/Fuel-Cells/European-Nations-Backing-Hydrogen-As-Viable-Alternative.html,"Hydrogen is seeing support grow in Europe as an alternative to oil and gas, and over renewable energy such as wind and solar.
On Tuesday, 25 European nations backed…",European Nations Backing Hydrogen As Viable Alternative,986
987,"Sep 20, 2018 at 11:38 ",https://d32r1sh890xpii.cloudfront.net/article/270x200/d3dac3871decbca49abd69aee66ca4f9.jpg,https://oilprice.com/Energy/Natural-Gas/Is-2018-A-Banner-Year-For-Gazprom.html,"So far, 2018 has been a good year for Gazprom. The Russian state-owned company is the biggest investor in oil and gas projects in the world with $160 billion…",Is 2018 A Banner Year For Gazprom?,987
988,"Sep 20, 2018 at 10:05 ",https://d32r1sh890xpii.cloudfront.net/article/270x200/658ebd3d0ec28230080f6ab761899549.jpg,https://oilprice.com/Energy/Crude-Oil/Oil-Prices-Slip-After-Trump-Slams-OPEC-On-Twitter.html,"As Brent Crude prices have been slowly creeping up to the $80 mark for a week, U.S. President Donald Trump took to Twitter again to slam OPEC about pushing prices…",Oil Prices Slip After Trump Slams OPEC On Twitter,988
989,"Sep 20, 2018 at 09:14 ",https://d32r1sh890xpii.cloudfront.net/article/270x200/4c6e0e25e7b9041b202e39dc5792d471.jpg,https://oilprice.com/Energy/Crude-Oil/Strong-Rise-In-Spending-Keeps-Offshore-Ahead-Of-Shale.html,"A recent surge in final investment decisions (FIDs) on offshore oil and gas projects has set the scene for a healthy increase in offshore investments next year, thus preventing the…",Strong Rise In Spending Keeps Offshore Ahead Of Shale,989
990,"Sep 19, 2018 at 16:16 ",https://d32r1sh890xpii.cloudfront.net/article/270x200/dd2ff120b7fd511a76bd762fbecfdd95.jpg,https://oilprice.com/Energy/Crude-Oil/Why-Oil-Markets-Cant-Escape-OPEC-Russia-Influence.html,OPEC members and their Russia-led non-OPEC allies have yet to decide how to share the 1 million bpd production boost they pledged in June. when they saw the market started…,"Why Oil Markets Can’t Escape OPEC, Russian Influence",990
991,"Sep 19, 2018 at 15:57 ",https://d32r1sh890xpii.cloudfront.net/article/270x200/3f6130b47e686845877553ac99cd11be.jpg,https://oilprice.com/Energy/Crude-Oil/Just-How-Low-Can-Irans-Oil-Exports-Go.html,Iran’s oil exports started to fall noticeably in August as key customers in Asia began to curtail oil purchases to either comply with the U.S. efforts to bring Iranian exports…,Just How Low Can Iran’s Oil Exports Go?,991
992,"Sep 19, 2018 at 13:56 ",https://d32r1sh890xpii.cloudfront.net/article/270x200/74d88ec5d1cc8be0fba6020bbbd27874.jpg,https://oilprice.com/Energy/Natural-Gas/Mexico-Aims-To-Become-The-Energy-Hub-Of-Latin-America.html,"Mexico could be at the precipice of a region-wide energy revolution, and natural gas is the key. The future of Mexico’s gas sector will be up for debate at the…",Mexico Aims To Become The Energy Hub Of Latin America,992
993,"Sep 19, 2018 at 13:26 ",https://d32r1sh890xpii.cloudfront.net/article/270x200/4c39a22c57ce36f3d7c9a8a942933ce2.jpg,https://oilprice.com/Energy/Energy-General/Nuclear-Power-Could-Be-Key-In-Reaching-Climate-Goals.html,"Nuclear power could contribute to achieving the Paris Agreement targets on climate change, but it would need help of its own to do that, a new report from the…",Nuclear Power Could Be Key In Reaching Climate Goals,993
994,"Sep 19, 2018 at 12:34 ",https://d32r1sh890xpii.cloudfront.net/article/270x200/bf70b42a2e654c4d944787380e1e273d.jpg,https://oilprice.com/Energy/Energy-General/Ex-GM-Boss-Tesla-Headed-For-The-Graveyard.html,"Tesla is an “automobile company that is headed for the graveyard,” as it doesn’t have any advantage over the scores of electric vehicles coming from the legacy automakers and can’t…",Ex GM Boss: Tesla ‘Headed For The Graveyard’,994
995,"Sep 19, 2018 at 12:23 ",https://d32r1sh890xpii.cloudfront.net/article/270x200/ba10b6e5839f98673c4d985c3ae604cc.jpg,https://oilprice.com/Energy/Energy-General/Is-This-A-Turning-Point-For-Electricity-Sales.html,Sales of electricity in the US have barely increased despite nine straight years of economic growth. It almost looks as if the conservation ethos for American consumers has finally taken…,Is This A Turning Point For Electricity Sales?,995
996,"Sep 19, 2018 at 11:48 ",https://d32r1sh890xpii.cloudfront.net/article/270x200/59cae6a1c470a9e2531671066a5ae7a4.jpg,https://oilprice.com/Energy/Natural-Gas/Germany-Blinks-First-In-Ongoing-European-Gas-War.html,"The U.S. is increasingly finding itself at odds against not only Beijing as Trump executes a sledge hammer approach to ongoing trade disputes with China, but also with Moscow, a…",Germany Blinks First In Ongoing European Gas War,996
997,"Sep 19, 2018 at 10:16 ",https://d32r1sh890xpii.cloudfront.net/article/270x200/2359fd39f3fd92ad9757332da9dc1a4a.jpg,https://oilprice.com/Energy/Energy-General/Oil-Companies-Slash-Debt-To-Pre-Crash-Levels.html,"Global energy companies reduced their debt for seven quarters running in the second quarter of 2018, cutting their long-term debt-to-equity ratio to the lowest since the third quarter of 2014,…",Oil Companies Slash Debt To Pre-Crash Levels,997
998,"Sep 19, 2018 at 09:44 ",https://d32r1sh890xpii.cloudfront.net/article/270x200/7d7a12192fcd27e8122a11de86e56760.jpg,https://oilprice.com/Energy/Crude-Oil/Oil-Prices-Inch-Higher-On-Crude-Gasoline-Draw.html,"After API’s latest surprise inventory build pressured oil prices, the Energy Information Administration cheered the market up by refuting the build and reporting instead yet another weekly draw, of…","Oil Prices Inch Higher On Crude, Gasoline Draw",998
999,"Sep 18, 2018 at 14:56 ",https://d32r1sh890xpii.cloudfront.net/article/270x200/70e641bdf6c3700515844b82b26844d8.jpg,https://oilprice.com/Energy/Energy-General/The-Biggest-Risk-In-Todays-Oil-Markets.html,"The oil market is “tightening up,” but the Trump administration could still spoil oil prices if its aggressive trade war against China drags down economic growth.
The U.S. stepped…",The Biggest Risk In Today’s Oil Markets,999
1000,"Sep 18, 2018 at 13:48 ",https://d32r1sh890xpii.cloudfront.net/article/270x200/adb78247f408e3222b531ac2c4303c3a.jpg,https://oilprice.com/Energy/Energy-General/Russia-Tells-Washington-To-Leave-Iran-Alone.html,"“This is unproductive, this is wrong,” Russia’s Energy Minister Alexander Novak recently said about the U.S. sanctions on Iran, indicating that Moscow will continue to back its ally in the…",Russia Tells Washington To Leave Iran Alone,1000
1001,"Sep 18, 2018 at 13:06 ",https://d32r1sh890xpii.cloudfront.net/article/270x200/595bfadc65eadf8335127d26b20d3091.jpg,https://oilprice.com/Energy/Energy-General/Iran-Sanctions-Are-Damaging-The-Dollar.html,"Painful sanctions on Iran have demonstrated the long reach of the U.S. Treasury, forcing much of the globe to fall in line and cut oil imports from Iran despite widespread…",Iran Sanctions Are Damaging The Dollar,1001
1002,"Sep 18, 2018 at 12:56 ",https://d32r1sh890xpii.cloudfront.net/article/270x200/82fa51c6486a5032faa95f6e9ee7ae2f.jpg,https://oilprice.com/Energy/Energy-General/Is-Russia-Smuggling-Fuel-To-North-Korea.html,"This week United States Ambassador to the United Nations Nikki Haley publicly accused Russia of “cheating” and ""actively working to undermine"" sanctions imposed by the U.N. on North Korea.…",Is Russia Smuggling Fuel To North Korea?,1002
1003,"Sep 18, 2018 at 12:46 ",https://d32r1sh890xpii.cloudfront.net/article/270x200/cbd56b8739861e78cd931833164a09c7.jpg,https://oilprice.com/Energy/Energy-General/Russia-Inks-Huge-Deal-With-Worlds-Top-LNG-Importer.html,Russian state-run gas giant Gazprom and Tokyo-based conglomerate Mitsui & Co. inked a memorandum of understanding (MOU) on liquefied natural gas (LNG) development last week. The MOU was signed…,Russia Inks Huge Deal With World’s Top LNG Importer,1003
1004,"Sep 18, 2018 at 12:35 ",https://d32r1sh890xpii.cloudfront.net/article/270x200/fa51f90184171dccd50dfcad5c7bb62a.jpg,https://oilprice.com/Energy/Energy-General/Oil-Markets-Unfazed-By-200-Billion-Trade-War-Escalation.html,"Oil prices are up slighting despite the ongoing tit-for-tat tariff war between the United States and China. 

(Click to enlarge)",Oil Markets Unfazed By $200 Billion Trade War Escalation,1004
1005,"Sep 18, 2018 at 11:39 ",https://d32r1sh890xpii.cloudfront.net/article/270x200/5bf0e7e11566d06d6fc68b62981a88bf.jpg,https://oilprice.com/Energy/Crude-Oil/Saudi-Oil-Inventories-Continue-To-Plummet.html,"In July, Saudi Arabia saw its highest crude oil stocks draw in eight months at 5.51 million barrels, after the Kingdom unexpectedly reduced its production compared to June while it…",Saudi Oil Inventories Continue To Plummet,1005
1006,"Sep 18, 2018 at 10:55 ",https://d32r1sh890xpii.cloudfront.net/article/270x200/817d0b7fef8ee3362f742ad27ecd9609.jpg,https://oilprice.com/Energy/Energy-General/US-Shale-Oil-Production-Beats-Estimates-Again.html,"Crude oil production in the U.S. shale patch will hit 7.59 million bpd next month, the Energy Information Administration said in its latest Drilling Productivity Report. This is 79,000…",U.S. Shale Oil Production Beats Estimates Again,1006
1007,"Sep 18, 2018 at 08:57 ",https://d32r1sh890xpii.cloudfront.net/article/270x200/a2d5a3b71bea606ba87a789b7f915b7f.jpg,https://oilprice.com/Energy/Energy-General/Oil-Prices-Jump-On-Saudi-Arabias-80-Claim.html,Oil prices were up early on Tuesday morning amid reports that Saudi Arabia would be comfortable letting oil prices rise above $80 a barrel and OPEC may not be rushing…,Oil Prices Jump On Saudi Arabia’s $80 Claim,1007
1008,"Sep 17, 2018 at 14:41 ",https://d32r1sh890xpii.cloudfront.net/article/270x200/7f435d6c04c6847cb31d085f728f1b04.jpg,https://oilprice.com/Energy/Oil-Prices/Why-WTI-Could-Crash-In-The-Coming-Weeks.html,"West Texas Intermediate could drop to US$65 a barrel later this year on the back of extra maintenance work at U.S. refineries, Tom Kloza from the Oil Price Information Service…",Why WTI Could Crash In The Coming Weeks,1008
1009,"Sep 17, 2018 at 14:41 ",https://d32r1sh890xpii.cloudfront.net/article/270x200/83baedbe37123349b122b62c619ade0c.jpg,https://oilprice.com/Energy/Crude-Oil/Is-The-Shale-Slowdown-Overblown.html,"The shale industry has hit a bit of a rough patch, with pipeline bottlenecks, cost inflation and a crowded field contributing to a drilling and production slowdown. But many in…",Is The Shale Slowdown Overblown?,1009
1010,"Sep 17, 2018 at 14:41 ",https://d32r1sh890xpii.cloudfront.net/article/270x200/a0d33e1c3394130d11fa9befe73f2da2.jpg,https://oilprice.com/Energy/Crude-Oil/Colorados-Oil-Industry-Braces-For-A-Devastating-Blow.html,"Colorado will vote on November 6 on a ballot proposition to increase the setback distance for drilling oil and gas wells by five times to 2,500 feet.
Proponents of the…",Colorado’s Oil Industry Braces For A Devastating Blow,1010
1011,"Sep 17, 2018 at 14:40 ",https://d32r1sh890xpii.cloudfront.net/article/270x200/2132b7cf42d472b94ee85ae523effdec.jpg,https://oilprice.com/Energy/Energy-General/The-Altay-Pipeline-A-Geopolitical-Game-Changer.html,"It is a matter of common knowledge that energy relations between Russia and China have boomed in the past decade, with all sorts of new infrastructure being built to facilitate…",The Altay Pipeline: A Geopolitical Game Changer,1011
1012,"Sep 17, 2018 at 12:34 ",https://d32r1sh890xpii.cloudfront.net/article/270x200/25824506c95883893bcdff4b69cd94fa.jpg,https://oilprice.com/Energy/Energy-General/Iraqs-Oil-Production-Problem.html,"Iraq’s oil production will only grow marginally over the next 10 years despite its potential capacity, which stands at as much as 7 million bpd, an analyst from IHS Markit…",Iraq’s Oil Production Problem,1012
1013,"Sep 17, 2018 at 12:17 ",https://d32r1sh890xpii.cloudfront.net/article/270x200/90e723f54665f44e6cb2e855f7e2d677.jpg,https://oilprice.com/Energy/Energy-General/Can-Millennials-Save-Tesla.html,"While they already had their hands full killing mayonnaise, Applebee’s, and countless other industries that make up the cornerstone of American culture, in these past weeks millennials…",Can Millennials Save Tesla?,1013
1014,"Sep 17, 2018 at 10:41 ",https://d32r1sh890xpii.cloudfront.net/article/270x200/e80c6f5e04e0dedd1b71021e01afb602.jpg,https://oilprice.com/Energy/Energy-General/The-Age-Of-Electrification-Has-Arrived.html,"Electric vehicles continue to gain market share at an accelerating rate, but electrification could go even further, expanding into the realm of commercial trucking, marine travel and even to airplanes.…",The Age Of Electrification Has Arrived,1014
1015,"Sep 17, 2018 at 10:07 ",https://d32r1sh890xpii.cloudfront.net/article/270x200/633d9d3d40235e5e3a2cc3ad5b86330d.jpg,https://oilprice.com/Energy/Energy-General/The-Massachusetts-Gas-Disaster-Could-Spark-An-Energy-Crisis.html,"An unprecedented tragedy struck a small portion of eastern Massachusetts last week when dozens of houses in the towns of Lawrence, Andover and North Andover in the Merrimack Valley began…",The Massachusetts Gas Disaster Could Spark An Energy Crisis,1015
1016,"Sep 17, 2018 at 09:29 ",https://d32r1sh890xpii.cloudfront.net/article/270x200/9d82f0df13c857e113a5bc35e5836fbc.jpg,https://oilprice.com/Energy/Energy-General/Iran-Accuses-Russia-And-Saudi-Arabia-Of-Stealing-Market-Share.html,"Russia and Saudi Arabia are eating into Iran’s oil market share, Tehran’s OPEC governor, Hossein Kazempour Ardebili, said in an interview with state oil agency Shana.
The official did…",Iran Accuses Russia And Saudi Arabia Of Stealing Market Share,1016
1017,"Sep 14, 2018 at 14:54 ",https://d32r1sh890xpii.cloudfront.net/article/270x200/04e8aad5261078ba2d645ce9a28e85b3.jpg,https://oilprice.com/Energy/Energy-General/Can-India-Afford-To-Cut-Iranian-Imports-To-Zero.html,"India is set to cut its imports of oil from Iran by half over the next two months, which will put a significant dent in Iran’s ability to find markets…",Can India Afford To Cut Iranian Imports To Zero?,1017
1018,"Sep 14, 2018 at 14:23 ",https://d32r1sh890xpii.cloudfront.net/article/270x200/aed8b0b38635b1f302ad3c9385bfe832.jpg,https://oilprice.com/Energy/Crude-Oil/Norways-Offshore-Oil-Boom-Is-Back-On.html,"The rise in oil prices brought about the recovery of Norway’s oil industry, with companies lining up plans to invest in boosting oil production on the Norwegian Continental Shelf (NCS)—surely…",Norway’s Offshore Oil Boom Is Back On,1018
1019,"Sep 14, 2018 at 14:20 ",https://d32r1sh890xpii.cloudfront.net/article/270x200/ac961ba3547948a3b4f726e4aaf3bab0.jpg,https://oilprice.com/The-Environment/Global-Warming/Refiners-Arent-To-Blame-For-Climate-Change.html,"For about a decade, Texas has considered the idea of erecting a coastal barrier to protect against the impacts of hurricanes. Texas A&M researchers concluded that a direct hit to Galveston from…",Refiners Aren’t To Blame For Climate Change,1019
1020,"Sep 14, 2018 at 14:18 ",https://d32r1sh890xpii.cloudfront.net/article/270x200/b643d6cfedf2185663d657f8cc5c76f7.jpg,https://oilprice.com/Energy/Energy-General/Diesel-Demand-Is-Set-To-Soar.html,"The International Maritime Organization’s new rules on fuel emissions that will come into effect in 2020 will help to lift diesel demand, according to industry insiders attending an S&P Global…",Diesel Demand Is Set To Soar,1020
1021,"Sep 14, 2018 at 14:15 ",https://d32r1sh890xpii.cloudfront.net/article/270x200/766eb03576bccf7b9c000f054e7eeecd.jpg,https://oilprice.com/Energy/Coal/Hurricane-Florence-Could-Send-Coal-Prices-Soaring.html,"As Hurricane Florence — a monster Category 2 storm — takes aim at southeastern United States, one of the country’s most important coal export hubs has halted operations due to looming…",Hurricane Florence Could Send Coal Prices Soaring,1021
1022,"Sep 14, 2018 at 14:09 ",https://d32r1sh890xpii.cloudfront.net/article/270x200/89cf2754c01187b73b59a644a7987d2f.jpg,https://oilprice.com/Energy/Crude-Oil/The-Millennials-Making-Millions-In-Texas-Oil.html,"John Sellers and Cody Campbell are holding court one hot August evening in the corner of an oil-themed dive bar in Midland, Texas. After flying in on their private jet,…",The Millennials Making Millions In Texas Oil,1022
1023,"Sep 14, 2018 at 14:02 ",https://d32r1sh890xpii.cloudfront.net/article/270x200/1f1f8fbc7b56b32074ff3abd2ebe17cf.jpg,https://oilprice.com/Geopolitics/International/The-US-Calls-On-Russia-To-Cap-Soaring-Oil-Prices.html,"As crucial mid-term congressional elections in November draw near, the Trump administration is feeling the heat over higher oil prices. London-traded global oil benchmark Brent breached the $80 per barrel…",The U.S. Calls On Russia To Cap Soaring Oil Prices,1023
1024,"Sep 14, 2018 at 14:00 ",https://d32r1sh890xpii.cloudfront.net/article/270x200/d9fd3db5104681a5fc92f8834d70602d.jpg,https://oilprice.com/Energy/Coal/Why-Cant-Japan-Kick-Coal-And-Nuclear.html,"Earlier this year we reported on a startling anomaly in the global energy market that even the experts couldn’t have predicted. Just one nation, alone against the greening tides,…",Why Can’t Japan Kick Coal And Nuclear?,1024
1025,"Sep 14, 2018 at 14:00 ",https://d32r1sh890xpii.cloudfront.net/article/270x200/f5e41963196ec9dd8fa2a46570441e13.jpg,https://oilprice.com/Energy/Energy-General/Are-Flying-Taxis-Just-4-Years-Away.html,"A British energy entrepreneur and former Formula 1 racing team owner, Stephen Fitzpatrick, thinks he’s got exactly what it takes to build a new inter-city “flying taxi” services and launch…",Are Flying Taxis Just 4 Years Away?,1025
1026,"Sep 14, 2018 at 14:00 ",https://d32r1sh890xpii.cloudfront.net/article/270x200/2c298f4693a3ca04ed49d6b536b6e54d.jpg,https://oilprice.com/Energy/Energy-General/Why-US-Electricity-Sales-Surged-In-2018.html,Sales of electricity in the U.S. have barely increased despite nine straight years of economic growth. It almost looks as if the conservation ethos for American consumers has finally taken…,Why U.S. Electricity Sales Surged In 2018,1026
1027,"Sep 14, 2018 at 13:59 ",https://d32r1sh890xpii.cloudfront.net/article/270x200/cc6d0d25befbe71b863fe39ba6d410b9.jpg,https://oilprice.com/Energy/Energy-General/An-Energy-Investor-Roadmap-For-The-Future.html,"I’ve been writing for O&E insider for nearly 6 years now. For this last column, I think the best thing would be to try to give a roadmap to you…",An Energy Investor Roadmap For The Future,1027
1028,"Sep 14, 2018 at 13:58 ",https://d32r1sh890xpii.cloudfront.net/article/270x200/085b4e9e3852ca2a7d628a4e93d76b53.jpg,https://oilprice.com/Energy/Energy-General/The-Oil-Sector-Opportunity-That-Cant-Be-Ignored.html,"If you’ll forgive the pun, oilfield service stocks are a well to which I have returned a couple of times this year, and with results that have so far been…",The Oil Sector Opportunity That Can’t Be Ignored,1028
1029,"Sep 14, 2018 at 13:57 ",https://d32r1sh890xpii.cloudfront.net/article/270x200/4985fc732ee600b6485615c336257386.jpg,https://oilprice.com/Energy/Energy-General/Oil-Price-Volatility-Increases-On-OPEC-Outages.html,"Friday September 14, 2018
In the latest edition of the Numbers Report, we’ll take a look at some of the most interesting figures put out this week in the energy…",Oil Price Volatility Increases On OPEC Outages,1029
1030,"Sep 14, 2018 at 13:56 ",https://d32r1sh890xpii.cloudfront.net/article/270x200/f57f2f61029731001867123456e62cd9.jpg,https://oilprice.com/Energy/Energy-General/Global-Energy-Advisory-14th-September-2018.html,"U.S. Energy Secretary Rick Perry this week held two high-profile meetings, one with his counterpart from Saudi Arabia and the other with his Russian counterpart. These meeting were an attempt…",Global Energy Advisory – 14th September 2018,1030
1031,"Sep 14, 2018 at 13:55 ",https://d32r1sh890xpii.cloudfront.net/article/270x200/34035d8310ed3f699bd224e2484c1846.jpg,https://oilprice.com/Energy/Energy-General/Oil-Prices-Trend-Upward-In-Fragile-Market.html,U.S. West Texas Intermediate and international-benchmark Brent crude oil futures are in a position to close higher for the week. Most of the gains occurred early in the week when…,Oil Prices Trend Upward In “Fragile” Market,1031
1032,"Sep 14, 2018 at 13:16 ",https://d32r1sh890xpii.cloudfront.net/article/270x200/d4261281276d0a2e11af3a3df8f665b7.jpg,https://oilprice.com/Energy/Energy-General/Iran-There-Is-No-Spare-Oil-Capacity.html,The United States won’t be able to bring Iranian oil exports to zero because the other producers can’t offset the loss of all of Iran’s oil barrels in an already…,Iran: There Is No Spare Oil Capacity,1032
1033,"Sep 14, 2018 at 13:09 ",https://d32r1sh890xpii.cloudfront.net/article/270x200/4f81902bb2ae551d63a5243d5cd098f6.jpg,https://oilprice.com/Energy/Energy-General/Oil-Markets-Enter-Crucial-Period.html,"Oil prices edged up this week on lost supply from Iran and Venezuela, although those supply concerns are somewhat offset by worries over demand. ",Oil Markets Enter “Crucial Period”,1033
1034,"Sep 14, 2018 at 12:24 ",https://d32r1sh890xpii.cloudfront.net/article/270x200/6b6b512abd943f611cc9f085824fc2d0.jpg,https://oilprice.com/Energy/Energy-General/Oil-Prices-Unfazed-By-Growing-Rig-Count.html,"Baker Hughes reported an additional seven U.S. rigs this week, bringing the total number of active oil and gas rigs to 1.055, according to the report. The number of active…",Oil Prices Unfazed By Growing Rig Count,1034
1035,"Sep 14, 2018 at 10:25 ",https://d32r1sh890xpii.cloudfront.net/article/270x200/fba95bd5b3947566829b9923e9cbbd21.jpg,https://oilprice.com/Energy/Energy-General/Maduro-Seeks-New-Funding-On-Visit-To-China.html,"Venezuela’s President Nicolas Maduro is meeting with the top Chinese officials, including President Xi Jinping, as the socialist leader of the troubled Latin American oil producer is looking to…",Maduro Seeks New Funding On Visit To China,1035
