,date,image_link,link,summary,title,article_id
461,"Nov 24, 2018 at 12:24 ",https://d32r1sh890xpii.cloudfront.net/article/270x200/781172234b20ea34c3f23ce968a847d1.jpg,https://oilprice.com/Energy/Energy-General/Why-The-China-Philippines-Energy-Deal-Wont-Last.html,"In a controversial move in this Southeast Asian country of nearly 100 million people, Philippine President Rodrigo Duterte and visiting Chinese President Xi Jinping lead officials from both sides yesterday…",Why The China-Philippines Energy Deal Won’t Last,461
462,"Nov 24, 2018 at 12:20 ",https://d32r1sh890xpii.cloudfront.net/article/270x200/6e5213c01f0f15a91c59240fe2030270.jpg,https://oilprice.com/Energy/Natural-Gas/India-Looks-To-Double-Its-Natural-Gas-Usage.html,This week Indian Prime Minister Narendra Modi announced that this administration is working toward establishing a natural gas trading exchange as part of a larger effort to relieve the rapidly…,India Looks To Double Its Natural Gas Usage,462
463,"Nov 24, 2018 at 08:00 ",https://d32r1sh890xpii.cloudfront.net/article/270x200/d9d6c96812523470e4d6544d688998bb.jpg,https://oilprice.com/Energy/Energy-General/Plunging-Oil-Prices-Weigh-On-Saudi-Bonds.html,"For investors looking for stability and income, bonds are usually considered an attractive proposition. In the current environment of rising interest rates, international bonds are likely to outperform U.S. bonds.…",Plunging Oil Prices Weigh On Saudi Bonds,463
464,"Nov 24, 2018 at 07:54 ",https://d32r1sh890xpii.cloudfront.net/article/270x200/e487375d92441a64e282ca90a6549cd7.jpg,https://oilprice.com/Energy/Energy-General/Russia-Iran-Face-Backlash-Over-Oil-Shipments-To-Syria.html,The U.S. Treasury Department has targeted six individuals and three entities that it says are part of an Iranian-Russian network providing millions of barrels of oil to the government of…,"Russia, Iran Face Backlash Over Oil Shipments To Syria",464
465,"Nov 23, 2018 at 16:46 ",https://d32r1sh890xpii.cloudfront.net/article/270x200/d500143ddee2b65920fe827d87e9169a.jpg,https://oilprice.com/Energy/Oil-Prices/Platts-Survey-Brent-Oil-Price-To-Average-75-Next-Year.html,"Brent Crude is expected to average $75.50 a barrel next year, according to an S&P Global Platts survey of 11 top banks and oil brokers, who see OPEC…",Platts Survey: Brent Oil Price To Average $75 Next Year,465
466,"Nov 23, 2018 at 16:45 ",https://d32r1sh890xpii.cloudfront.net/article/270x200/709665e72e4ab82ec4cdfb750e94948a.jpg,https://oilprice.com/Energy/Energy-General/Oil-Prices-Collapse-On-Supply-Surge.html,"Oil prices collapsed on Friday, with WTI threatening to break the $50 mark and Brent falling below $60 for the first time in over a year.",Oil Prices Collapse On Supply Surge,466
467,"Nov 22, 2018 at 15:45 ",https://d32r1sh890xpii.cloudfront.net/article/270x200/317b0b6bc029e9fa7abf285b33f6b7d9.jpg,https://oilprice.com/Energy/Energy-General/Does-The-US-Really-Need-Saudi-Oil.html,"“Saudi Arabia — if we broke with them, I think your oil prices would go through the roof. I’ve kept them down,” President Trump told reporters on Tuesday. “They’ve helped…",Does The U.S. Really Need Saudi Oil?,467
468,"Nov 22, 2018 at 15:18 ",https://d32r1sh890xpii.cloudfront.net/article/270x200/f8763df83990ef23988c7bb80d6b2aeb.jpg,https://oilprice.com/Energy/Energy-General/Trumps-Impossible-Decision-Over-Saudi-Arabia.html,"The chips are finally starting to fall in place for Saudi Arabia over the killing of dissident Saudi journalist Jamal Khashoggi last month. Early Thursday, Denmark announced that it…",Trump’s Impossible Decision Over Saudi Arabia,468
469,"Nov 22, 2018 at 12:28 ",https://d32r1sh890xpii.cloudfront.net/article/270x200/6cc81db55c97ec25ef7ba07d0adeba27.jpg,https://oilprice.com/Energy/Energy-General/A-Gamechanger-In-European-Gas-Markets.html,The Southern Gas Corridor on which the European Union is pinning most of its hopes for natural gas supply diversification away from Russia is coming along nicely and will not…,A Gamechanger In European Gas Markets,469
470,"Nov 22, 2018 at 11:43 ",https://d32r1sh890xpii.cloudfront.net/article/270x200/fd779d61ed3714f58d19e4c13ad87ab4.jpg,https://oilprice.com/Energy/Crude-Oil/Can-Oil-Solve-Washingtons-Syria-Dilemma.html,"In the past seven years Syrian cities have been reduced to rubble, thousands have lost their lives, but the main objective of the U.S. and its allies to remove Bashar…",Can Oil Solve Washington’s Syria Dilemma?,470
471,"Nov 22, 2018 at 11:02 ",https://d32r1sh890xpii.cloudfront.net/article/270x200/efad11ec332b560618dad4940f495357.jpg,https://oilprice.com/Energy/Crude-Oil/Irans-Tracked-Oil-Exports-Plunged-With-Start-Of-US-Sanctions.html,"Iran’s tracked oil exports in November plummeted by several hundred thousand barrels per day compared to October, as many Iranian customers hadn’t nominated barrels amid uncertainty whether they would get…",What Explains The Sudden Plunge In Iranian Oil Exports?,471
472,"Nov 22, 2018 at 10:34 ",https://d32r1sh890xpii.cloudfront.net/article/270x200/df870e8abe1dc78620da54dda94b83ed.jpg,https://oilprice.com/Finance/investing-and-trading-reports/Is-The-Worlds-Most-Indebted-Oil-Company-About-To-Be-Privatized.html,"In the past, Brazil’s massive state-owned oil company Petroleo Brasileiro SA (Petrobras) has operated at the whim of Brazilian politics, a volatile model to say the least. After years of…",Is The World’s Most Indebted Oil Company About To Be Privatized?,472
473,"Nov 22, 2018 at 10:36 ",https://d32r1sh890xpii.cloudfront.net/article/270x200/bac11c7b5675a5ef16b66b91d7d7508d.jpg,https://oilprice.com/Energy/Energy-General/High-Volatility-In-Oil-Gas-Continues.html,"Thanksgiving week usually features low-volume, low-volatility moves in the energy complex, but so far in this holiday-shortened week, we have seen none of that with crude prices being influenced by…",High Volatility In Oil & Gas Continues,473
474,"Nov 22, 2018 at 09:42 ",https://d32r1sh890xpii.cloudfront.net/article/270x200/dd0a94d83f6f5947267ec052a18129e8.jpg,https://oilprice.com/Energy/Energy-General/JP-Morgan-Cuts-Its-Oil-Price-Outlook-For-2019.html,"JP Morgan has revising its outlook on Brent crude to US$73 per barrel on average, CNBC reports. The bank’s earlier forecast was for an average Brent crude price of…",JP Morgan Cuts Its Oil Price Outlook For 2019,474
475,"Nov 21, 2018 at 17:20 ",https://d32r1sh890xpii.cloudfront.net/article/270x200/8e96983b2b22b720321e4a3dc4d0f2e2.jpg,https://oilprice.com/Energy/Energy-General/Economic-Turmoil-Could-Send-Oil-Even-Lower.html,"Global financial markets are once again throwing up some warning signs, as the selloff in equities entirely erased the gains made in U.S. stock markets for 2018. The economic and…",Economic Turmoil Could Send Oil Even Lower,475
476,"Nov 21, 2018 at 17:13 ",https://d32r1sh890xpii.cloudfront.net/article/270x200/7a4a92e4601f3ffa0f942f92be62f3ed.jpg,https://oilprice.com/Energy/Crude-Oil/The-Wildcard-In-OPECs-New-Deal.html,"When last week news broke that Libya’s UN-recognized government and the eastern rival government might just be willing to settle their differences and hold elections early next year, its…",The Wildcard In OPEC's Next Deal,476
477,"Nov 21, 2018 at 15:50 ",https://d32r1sh890xpii.cloudfront.net/article/270x200/2da0ea05436ce61829b391de67e43d5a.jpg,https://oilprice.com/Energy/Crude-Oil/US-Sanction-Waivers-Boost-Chinas-Demand-for-Iranian-Oil.html,Iran’s largest oil customer China is set to continue importing robust volumes of Iranian crude at least through the end of this year thanks to the U.S. waivers to eight…,U.S. Sanction Waivers Boost China’s Demand For Iranian Oil,477
478,"Nov 21, 2018 at 13:10 ",https://d32r1sh890xpii.cloudfront.net/article/270x200/3d47db40adce2567ab514ec0fbc41b0f.jpg,https://oilprice.com/Energy/Oil-Prices/Trump-Thanks-Saudis-For-Lower-Oil-Prices-Wants-Even-Cheaper-Crude.html,"It didn’t take long for U.S. President Donald Trump to comment on oil prices, just ten days after he expressed hope that OPEC wouldn’t cut oil production.
On Wednesday morning,…","Trump Thanks Saudis For Lower Oil Prices, Wants Even Cheaper Crude",478
479,"Nov 21, 2018 at 13:35 ",https://d32r1sh890xpii.cloudfront.net/article/270x200/7872c24b2e2af958043ab25f3abe3002.jpg,https://oilprice.com/Energy/Energy-General/Could-Trump-And-Xi-Kill-Bearish-Sentiment-In-Oil.html,"On November 30th two rather powerful men are set to have a meeting in Argentina and they may very well decide the short-term fate of global oil prices.
Markets have…",Could Trump And Xi Kill Bearish Sentiment In Oil?,479
480,"Nov 21, 2018 at 13:32 ",https://d32r1sh890xpii.cloudfront.net/article/270x200/d25224a9312ae3324aea198cf6e566e5.jpg,https://oilprice.com/Energy/Energy-General/Global-Intelligence-Report-21st-November-2018.html,"Sources
- Middle East analyst based in Dubai, with access to Saudi royal advisors and business elite- Libyan investigative journalist in Tripoli- Turkish investigative journalist in Istanbul-…",Global Intelligence Report - 21st November 2018,480
481,"Nov 21, 2018 at 13:27 ",https://d32r1sh890xpii.cloudfront.net/article/270x200/a046f7d14bdd190a1b22ca82a44abdf4.jpg,https://oilprice.com/Energy/Energy-General/Iraq-The-Remaining-Lifeline-For-Iran.html,"Having looked thoroughly into the implications of the latest U.S. Iran sanctions throughout the past few weeks, it is reasonable to ask who stands to benefit from such a set-up.…",Iraq: The Remaining Lifeline For Iran,481
482,"Nov 21, 2018 at 13:23 ",https://d32r1sh890xpii.cloudfront.net/article/270x200/ee0d20ce6db0409947163789ba5f829f.jpg,https://oilprice.com/Energy/Energy-General/The-Biofuel-Directive-Giving-EU-Oil-Demand-A-Boost.html,"ILUC is a little-known acronym that strikes fear into the heart of biofuels producers.
It stands for Indirect Land Use Change and describes a change in land use, for example…",The Biofuel Directive Giving EU Oil Demand A Boost,482
483,"Nov 21, 2018 at 13:18 ",https://d32r1sh890xpii.cloudfront.net/article/270x200/e1836072b5d6cfc79f770a5c9dc54f0a.jpg,https://oilprice.com/Energy/Energy-General/Volatility-Rules-As-Oil-Markets-Wait-On-OPEC.html,"December 6 might become the next key milestone in OPEC’s drive to keep oil prices within a more or less universally acceptable range. Until then, we are going to see…",Volatility Rules As Oil Markets Wait On OPEC,483
484,"Nov 21, 2018 at 12:51 ",https://d32r1sh890xpii.cloudfront.net/article/270x200/96c5d4102df2be9daccaca37b2beac10.jpg,https://oilprice.com/Energy/Natural-Gas/South-Korea-Dominates-Global-LNG-Shipping-Market.html,South Korea is continuing to hold its dominant position in tanker delivery of liquefied natural gas (LNG) by winning major shipping orders over the next three years valued at…,South Korea Dominates Global LNG Shipping Market,484
485,"Nov 21, 2018 at 12:34 ",https://d32r1sh890xpii.cloudfront.net/article/270x200/3a4da7f2368932dfc40ef263fd57330d.jpg,https://oilprice.com/Energy/Energy-General/Rig-Count-Falls-Amid-Recovering-Oil-Prices.html,"Baker Hughes reported a 3-rig decrease for oil and gas in the United States this week. The total number of active oil and gas drilling rigs now stands at 1,079…",Rig Count Falls Amid Recovering Oil Prices,485
486,"Nov 21, 2018 at 11:51 ",https://d32r1sh890xpii.cloudfront.net/article/270x200/ec26f6e97c4d900df844130324fd4385.jpg,https://oilprice.com/Geopolitics/Asia/New-Oil-Deals-To-Ease-Tensions-In-South-China-Sea.html,China and the Philippines have just announced an official agreement to go forward with a groundbreaking joint oil and gas exploration deal - reportedly the biggest oil and gas…,New Oil Deals To Ease Tensions In South China Sea,486
487,"Nov 21, 2018 at 09:49 ",https://d32r1sh890xpii.cloudfront.net/article/270x200/cd63de10f5ac128131879b7f8f418dbc.jpg,https://oilprice.com/Energy/Crude-Oil/Oil-Prices-Inch-Lower-On-Crude-Inventory-Build.html,"A day after the American Petroleum Institute’s weekly inventory estimate slowed down the price decline in West Texas Intermediate, the Energy Information Administration dampened optimism by reporting a…",Oil Prices Inch Lower On Crude Inventory Build,487
488,"Nov 21, 2018 at 09:11 ",https://d32r1sh890xpii.cloudfront.net/article/270x200/58d5ed9ed86e015ade668766f126a984.jpg,https://oilprice.com/Energy/Oil-Prices/Goldman-Expects-Extreme-Volatility-In-Oil-Markets-This-Month.html,"Goldman Sachs expects the heightened oil price volatility that began last week to continue into the next few weeks, the investment bank said in a note to clients…",Goldman Expects Extreme Volatility In Oil Markets This Month,488
489,"Nov 20, 2018 at 17:43 ",https://d32r1sh890xpii.cloudfront.net/article/270x200/820f30ef2b38cb114311b7f708022202.jpg,https://oilprice.com/Energy/Energy-General/Oil-Prices-Tank-As-Supply-Glut-Fears-Return.html,"Oil prices collapsed on Tuesday for the second time in a week. During midday trading, WTI fell below $55 per barrel and Brent dropped below $65 per barrel. Both benchmarks…",Oil Prices Tank As Supply Glut Fears Return,489
490,"Nov 20, 2018 at 17:25 ",https://d32r1sh890xpii.cloudfront.net/article/270x200/c717861134a7412659bde3c4cae1b1a4.jpg,https://oilprice.com/Energy/Oil-Prices/Is-There-Any-Hope-Left-For-Oil-Bulls.html,"Oil prices are off 25 percent from their four-year highs reached in early October, after the massive sell-off that began later that month which dragged crude oil squarely into bear…",Is There Any Hope Left For Oil Bulls?,490
491,"Nov 20, 2018 at 16:59 ",https://d32r1sh890xpii.cloudfront.net/article/270x200/e31c9cea6c75d80e1d3072b6767799a6.jpg,https://oilprice.com/Energy/Energy-General/The-Oil-Industry-Is-Facing-A-Capex-Conundrum.html,"Oil industry executives are surely pleased with themselves this year, with both large and small companies reporting improved financials after years of struggling.
A Reuters survey finds a significant…","The Oil Industry Is Facing A ""Capex Conundrum""",491
492,"Nov 20, 2018 at 14:32 ",https://d32r1sh890xpii.cloudfront.net/article/270x200/c33b6b6f0747d30a7f073d5d41c313ae.jpg,https://oilprice.com/Energy/Crude-Oil/Is-It-Too-Late-To-Avoid-An-Oil-Supply-Crisis.html,"Wood Mackenzie isn’t pulling any punches. “The warning signs are there – the industry isn’t finding enough oil.”
And its latest report continues in the same ‘spade is a spade’…",Is It Too Late To Avoid An Oil Supply Crisis?,492
493,"Nov 20, 2018 at 14:30 ",https://d32r1sh890xpii.cloudfront.net/article/270x200/5539056fd776d00b1b278fe73ce2df65.jpg,https://oilprice.com/Energy/Energy-General/Oil-Companies-Lose-1-Trillion-As-Prices-Crash.html,"Bearish sentiment has taken hold of oil markets, with oil and gas companies having lost $1 trillion since oil began its latest slide. 

(Click to…",Oil Companies Lose $1 Trillion As Prices Crash,493
494,"Nov 20, 2018 at 12:50 ",https://d32r1sh890xpii.cloudfront.net/article/270x200/f8d011d2de33f46887ce1318c51ca7ec.jpg,https://oilprice.com/Energy/Crude-Oil/Why-Aramco-Abandoned-The-40-Billion-Bond-Sale.html,Saudi Aramco has changed its mind about a bond sale of about US$40 billion that would have funded the bigger part of its planned acquisition of a majority stake in…,Why Aramco Abandoned The $40 Billion Bond Sale,494
495,"Nov 20, 2018 at 12:06 ",https://d32r1sh890xpii.cloudfront.net/article/270x200/de182c7b1d2616981196f022c5c78b57.jpg,https://oilprice.com/Energy/Crude-Oil/UAE-OPEC-Very-Likely-To-Agree-To-Oil-Production-Cuts.html,"OPEC will very likely agree to cut oil production at its upcoming meeting in early December, although the size of the cuts is yet to be decided, Ahmed al-Kaabi,…",UAE: OPEC Very Likely To Agree To Oil Production Cuts,495
496,"Nov 20, 2018 at 10:54 ",https://d32r1sh890xpii.cloudfront.net/article/270x200/05d706158ddc382e524dd5eec89fe769.jpg,https://oilprice.com/Energy/Energy-General/Chinas-Oil-Inventories-Rise-4167-In-One-Month.html,"Crude oil stockpiles in China rose by 29.09 million barrels last month from a month before and are likely to continue up, S&P Global Platts calculations have suggested. The…",China’s Oil Inventories Rise 416.7% In One Month,496
497,"Nov 20, 2018 at 09:30 ",https://d32r1sh890xpii.cloudfront.net/article/270x200/d601974f69fb45a1e0f0ac01da92421a.jpg,https://oilprice.com/Energy/Crude-Oil/Alberta-To-Fight-Air-Barrels-As-Prices-Continue-To-Plunge.html,Albertan oil producers need to become warier of overbooking already filled to capacity oil pipelines creating what’s commonly called “air barrels” as these contribute to the huge discount Canadian crude…,Alberta To Fight “Air Barrels” As Prices Continue To Plunge,497
498,"Nov 19, 2018 at 17:58 ",https://d32r1sh890xpii.cloudfront.net/article/270x200/6b29c2b2ddfe9dff4d85dbfce31af6aa.jpg,https://oilprice.com/Geopolitics/International/The-Impending-Endgame-In-Oil-Markets.html,"U.S. president Trump is facing strong internal pressure to punish Saudi Arabia in the coming days.
For Washington, however, this could be a double-edged sword, as turning on Saudi Crown…",The Impending Endgame In Oil Markets,498
499,"Nov 19, 2018 at 17:47 ",https://d32r1sh890xpii.cloudfront.net/article/270x200/bbdca2cc3702084ee38100704b29fefd.jpg,https://oilprice.com/Energy/Crude-Oil/This-Diplomatic-Breakthrough-Could-Slam-Oil-Prices.html,"Iraq is set to bring long disrupted oil back online, adding fresh barrels to a market already weighed down by ample supplies across the globe.
A little over a year…",This Diplomatic Breakthrough Could Slam Oil Prices,499
500,"Nov 19, 2018 at 17:00 ",https://d32r1sh890xpii.cloudfront.net/article/270x200/c76f9666cab00701df78c6df1ee1ab1c.jpg,https://oilprice.com/Energy/Energy-General/The-Newest-Sweet-Spots-In-US-Shale.html,"Over the past three years, the Permian has been the focus of both oil analyst and buyers’ attention. Most of the new drilling and asset acquisitions in America took place…",The Newest Sweet Spots In U.S. Shale,500
501,"Nov 19, 2018 at 13:34 ",https://d32r1sh890xpii.cloudfront.net/article/270x200/9756107d26807d5d96f5be1cb58b6898.jpg,https://oilprice.com/Energy/Crude-Oil/IEA-Chief-Urges-Oil-Producers-Not-To-Cut-Output.html,"While OPEC is considering cutting oil production again, the executive director of the International Energy Agency (IEA), Fatih Birol, called on Monday for ‘common sense’ because fresh cuts could have…",IEA Chief Urges Oil Producers Not To Cut Output,501
502,"Nov 19, 2018 at 13:34 ",https://d32r1sh890xpii.cloudfront.net/article/270x200/f8caa241de021819fd7fac40ecad57c1.jpg,https://oilprice.com/Geopolitics/International/Iran-US-Has-Failed-To-Stop-Oil-Exports.html,"Iran’s president Hassan Rouhani said on Monday that the country will continue to export oil despite fresh U.S. sanctions, which he described as “psychological war doomed to failure.”
“We…",Iran: U.S. Has Failed To Stop Oil Exports,502
503,"Nov 19, 2018 at 13:00 ",https://d32r1sh890xpii.cloudfront.net/article/270x200/21a1d9ad9a4bed479c214a417eda21ba.jpg,https://oilprice.com/Energy/Energy-General/The-Implications-Of-Soaring-Diesel-Prices.html,"Refineries are producing excessive amounts of gasoline in a bid to cope with strong demand for diesel, Reuters’ John Kemp wrote in a recent column. As a result, gasoline…",The Implications Of Soaring Diesel Prices,503
504,"Nov 19, 2018 at 12:21 ",https://d32r1sh890xpii.cloudfront.net/article/270x200/0b74129207e5b7631e3933128ecd07a2.jpg,https://oilprice.com/Alternative-Energy/Nuclear-Power/Another-Nuclear-Megaproject-Bites-The-Dust.html,"Toshiba, the troubled Japanese electrical and electronics conglomerate and former owner of the bankrupt Westinghouse, Corp., decided last week cancel its Moorside nuclear project in the UK. If completed, this…",Another Nuclear Megaproject Bites The Dust,504
505,"Nov 19, 2018 at 11:06 ",https://d32r1sh890xpii.cloudfront.net/article/270x200/5461ccbca099b46dac148d5f0a5b4492.jpg,https://oilprice.com/Energy/Crude-Oil/Oil-Slips-As-Russia-Mulls-Production-Cuts.html,"Russia’s energy ministry is discussing potential oil production cuts with local producers and will continue talks to come up with a position by the OPEC/non-OPEC meeting in early December, Energy…",Oil Slips As Russia Mulls Production Cuts,505
506,"Nov 19, 2018 at 09:34 ",https://d32r1sh890xpii.cloudfront.net/article/270x200/f33ea5b20e5174e50006ec5533eedbbf.jpg,https://oilprice.com/Energy/Natural-Gas/Natural-Gas-Price-Explosion-Bankrupts-Traders.html,"A Tampa, Florida based options trading firm, OptionSellers, went dark this weekend after it informed its clients of a “catastrophic loss event,” resulting from a short squeeze on the…",Natural Gas Price Explosion Bankrupts Traders,506
507,"Nov 16, 2018 at 16:31 ",https://d32r1sh890xpii.cloudfront.net/article/270x200/c5de3c312aa21ad50435b9dd3cfcbaee.jpg,https://oilprice.com/Energy/Oil-Prices/Can-We-Expect-A-Major-Rebound-In-Oil-Prices.html,"After declining by more than 20 percent from the October peak, oil prices are showing some signs that they have now bottomed out.
WTI hit a low point at $56…",Can We Expect A Major Rebound In Oil Prices?,507
508,"Nov 16, 2018 at 16:31 ",https://d32r1sh890xpii.cloudfront.net/article/270x200/28e2caea7b33434e9926d7884b211031.jpg,https://oilprice.com/Geopolitics/International/The-Saudis-Are-Hinting-At-Another-U-Turn-In-Oil-Markets.html,"A month after President Donald Trump announced that the United States was withdrawing from the Iran nuclear deal and re-imposing sanctions on Tehran’s oil, Iran’s archrival and OPEC’s de facto…",The Saudis Are Hinting At Another U-Turn In Oil Markets,508
509,"Nov 16, 2018 at 16:31 ",https://d32r1sh890xpii.cloudfront.net/article/270x200/c69e81b108ced761d3dbca50341fb341.jpg,https://oilprice.com/Energy/Energy-General/Expert-Commentary-A-Record-Setting-Week-In-Energy.html,It was a record setting week in the energy complex with crude oil posting one of its biggest declines since the price collapse in 2014 and natural gas posting back-to-back…,Expert Commentary: A Record Setting Week In Energy,509
510,"Nov 16, 2018 at 16:31 ",https://d32r1sh890xpii.cloudfront.net/article/270x200/c678aa35dfe02e59c1eb0aa900de8090.jpg,https://oilprice.com/Alternative-Energy/Renewable-Energy/New-Quotas-Could-Trigger-EV-Breakthrough-In-China.html,"When China first announced its plans to slap EV production quotas on local carmakers back in 2017, the news got a lot of coverage. The media placed emphasis on the…",New Quotas Could Trigger EV Breakthrough In China,510
511,"Nov 16, 2018 at 16:30 ",https://d32r1sh890xpii.cloudfront.net/article/270x200/a3235e2855ffe974257b983ecc7e3e9a.jpg,https://oilprice.com/Energy/Energy-General/What-The-Oil-Price-Collapse-Says-About-The-Economy.html,"In Tuesday’s technical update, I discussed the breakdown in the major markets both internationally as well as domestically. Of note, was the massive bear market in China which is…",What The Oil Price Collapse Says About The Economy,511
512,"Nov 16, 2018 at 16:30 ",https://d32r1sh890xpii.cloudfront.net/article/270x200/0536d56596c19a2151012bb405add525.jpg,https://oilprice.com/Energy/Crude-Oil/Oil-Prices-May-Have-Reached-A-Bottom.html,"Last Friday, oil prices fell for the 10th consecutive day. According to CNBC, this marked the longest losing streak for crude oil in 34 years.
I have covered the factors…",Oil Prices May Have Reached A Bottom,512
513,"Nov 16, 2018 at 16:30 ",https://d32r1sh890xpii.cloudfront.net/article/270x200/4f17dacba3da0002be7e1aac378fb4fb.jpg,https://oilprice.com/Geopolitics/International/Why-The-EU-Cant-Save-Iran.html,"The full impact of U.S. sanctions on Iran is still to be assessed, as major underlying factors remain opaque.
OPEC’s current fear of an oil glut in 2019, as indicated…",Why The EU Can't Save Iran,513
514,"Nov 16, 2018 at 16:29 ",https://d32r1sh890xpii.cloudfront.net/article/270x200/6ff75a86e14d8f6560f44baacac29124.jpg,https://oilprice.com/Finance/investing-and-trading-reports/How-To-Play-A-Recovery-In-Oil-Prices.html,"“Feel” is a concept that, in analysis at least, doesn’t get the respect it deserves. We are all supposed to have only logical, analytical reasons for believing something is about…",How To Play A Recovery In Oil Prices?,514
515,"Nov 16, 2018 at 16:29 ",https://d32r1sh890xpii.cloudfront.net/article/270x200/289e60e3455da49b16adc7c590f29126.jpg,https://oilprice.com/Energy/Crude-Oil/Alaska-Sees-Record-Breaking-Year-For-Oil-And-Gas-Leases.html,"Alaska is still trying to make an oil production comeback after years of declining production from maturing fields. On Wednesday, the Alaska Department of Natural Resources said in a release…",Alaska Sees Record Breaking Year For Oil And Gas Leases,515
516,"Nov 16, 2018 at 16:29 ",https://d32r1sh890xpii.cloudfront.net/article/270x200/f0b7f67e47c050f9d29611ccffc3ba26.jpg,https://oilprice.com/Geopolitics/International/Trump-Claims-Victory-As-Oil-Prices-Plummet.html,"Oil prices are now down over 20 percent from recent highs, and President Trump knows exactly where the credit for that belongs. “If you look at oil prices they’ve come…",Trump Claims Victory As Oil Prices Plummet,516
517,"Nov 16, 2018 at 16:28 ",https://d32r1sh890xpii.cloudfront.net/article/270x200/440dfaf2690288cbca9f1372dd7f383a.jpg,https://oilprice.com/Energy/Energy-General/Russia-Takes-Major-Leap-In-European-Gas-War.html,"On November 19th, President Putin will stand shoulder to shoulder with President Erdogan during a ceremony to celebrate the completion of the first string of Turk Stream. The subsea…",Russia Takes Major Leap In European Gas War,517
