,date,image_link,link,summary,title,article_id
1490,"Jul 19, 2018 at 14:12 ",https://d32r1sh890xpii.cloudfront.net/article/270x200/a5759d218e9ca8bc6f68afb0c6ffde8c.jpg,https://oilprice.com/Energy/Crude-Oil/Oil-Investors-Look-To-Utah-For-Long-Term-Riches.html,"The rise in oil prices has resulted in relentless drilling and booming production in the U.S. shale plays, and the Permian in West Texas is attracting the most drillers, analysts,…",Oil Investors Look To Utah For Long-Term Riches,1490
1491,"Jul 19, 2018 at 14:04 ",https://d32r1sh890xpii.cloudfront.net/article/270x200/c377903b4d6c5e5d030fbf4b8f10524b.jpg,https://oilprice.com/Energy/Energy-General/Independents-Replace-Big-Oil-In-Southeast-Asia.html,"Energy independents and Middle Eastern and Asian companies are expanding their presence in the Southeast Asian oil and gas industry, replacing Big Oil majors that have been shrinking their exposure…",Independents Replace Big Oil In Southeast Asia,1491
1492,"Jul 19, 2018 at 13:54 ",https://d32r1sh890xpii.cloudfront.net/article/270x200/6588a16e95a49ba0244f234d35ae51c8.jpg,https://oilprice.com/Energy/Energy-General/Oil-Prices-Rebound-As-Saudis-Expect-Reduced-Exports-In-August.html,"Saudi Arabia is expecting a reduction in crude oil exports next month, despite earlier signs that Saudi Arabia—and Russia—have started to raise production even before the June 22 meeting…",Oil Prices Rebound As Saudis Expect Reduced Exports In August,1492
1493,"Jul 19, 2018 at 12:26 ",https://d32r1sh890xpii.cloudfront.net/article/270x200/f199b6618d2d59d7b7c1b3956cd20954.jpg,https://oilprice.com/Geopolitics/Middle-East/Iran-Files-Complaint-Against-US-For-Unlawful-Sanctions.html,"On Monday, Iranian Foreign Minister Mohammad Javad Zarif said on Twitter that Iran had filed a complaint against the U.S. with the International Court of Justice (ICJ) to ""hold…",Iran Files Complaint Against U.S. For “Unlawful” Sanctions,1493
1494,"Jul 19, 2018 at 12:17 ",https://d32r1sh890xpii.cloudfront.net/article/270x200/f1bffb5c4bf67e9403c5393b894aae30.jpg,https://oilprice.com/Energy/Energy-General/Has-The-Movement-For-CO2-Controls-Peaked.html,The signs don’t look favorable for carbon dioxide emissions controls in the U.S. The Trump administra-tion along with much of the Republican party clearly do not believe in climate change…,Has The Movement For CO2 Controls Peaked?,1494
1495,"Jul 19, 2018 at 11:30 ",https://d32r1sh890xpii.cloudfront.net/article/270x200/749f5d35e36fae742bed2a497417bc05.jpg,https://oilprice.com/Energy/Crude-Oil/China-Just-Doubled-Oil-Shipments-To-North-Korea.html,"After the recent visits of North Korean leader Kim Jong-un to China, Beijing has almost doubled the volume of crude oil pipeline shipments to North Korea, South Korea’s newspaper Chosun…",China Just Doubled Oil Shipments To North Korea,1495
1496,"Jul 19, 2018 at 11:02 ",https://d32r1sh890xpii.cloudfront.net/article/270x200/89b669a3ff8789d501622fba8bc81004.jpg,https://oilprice.com/Energy/Energy-General/Is-This-The-Next-Global-Leader-In-Ride-Hailing-Services.html,"Chinese ride-hailing giant Didi Chuxing took another step forward in its strategy of being a global leader in mobility services.
Booking Holdings, which runs popular online travel services like Priceline.com,…",Is This The Next Global Leader In Ride Hailing Services?,1496
1497,"Jul 19, 2018 at 08:16 ",https://d32r1sh890xpii.cloudfront.net/article/270x200/2dd2864150a624664a7c81d6b1e1af7f.jpg,https://oilprice.com/Energy/Energy-General/Oil-Prices-Slip-As-OPEC-Compliance-Falls-To-120-Percent-In-June.html,"Oil prices rallied on Wednesday afternoon despite the fact that OPEC/NOPEC’s compliance fell from 147 percent in May to around 120 in June, according to sources cited by Reuters.
At…",Oil Prices Slip As OPEC+ Compliance Falls To 120 Percent In June,1497
1498,"Jul 18, 2018 at 14:30 ",https://d32r1sh890xpii.cloudfront.net/article/270x200/6def3e446a7947323f788020708a61d2.jpg,https://oilprice.com/Energy/Crude-Oil/Oil-Prices-At-Risk-Of-Economic-Downturn.html,"Oil prices have retreated as disrupted supply from Libya has started to come back online, threatening the recent gains in oil prices. But a bigger threat to crude over the…",Oil Prices At Risk Of Economic Downturn,1498
1499,"Jul 18, 2018 at 14:29 ",https://d32r1sh890xpii.cloudfront.net/article/270x200/1869913bd60aacb4db94be04cf3312b4.jpg,https://oilprice.com/Energy/Crude-Oil/Houston-To-Overtake-Cushing-As-Key-Hub.html,"Houston is emerging as one of the great oil hubs in the world, and pretty soon it will be outfitted with an oil futures contract, which could cement its position.…",Houston To Overtake Cushing As Key Hub,1499
1500,"Jul 18, 2018 at 14:29 ",https://d32r1sh890xpii.cloudfront.net/article/270x200/a483debfaee42919bd72847eea05a46d.jpg,https://oilprice.com/Energy/Crude-Oil/Oil-Sector-Under-Fire-In-Libyan-Corruption-Crackdown.html,"The latest port blockade in Libya, which had sent the country’s oil production plunging and oil prices surging, was lifted last week with new promises of transparency and the…",Oil Sector Under Fire In Libyan Corruption Crackdown,1500
1501,"Jul 18, 2018 at 14:26 ",https://d32r1sh890xpii.cloudfront.net/article/270x200/14f3edbfbedd76f8a86dac422fcda2c8.jpg,https://oilprice.com/Energy/Energy-General/Wind-Energy-Is-Getting-Cheaper-And-Cheaper.html,"Who would have thought wind’s transformation from subsidy-supported to self-financing power source would happen so quickly – not this publication, that’s for sure.
Apart from diehard environmentalists, most consumers have…",Wind Energy Is Getting Cheaper And Cheaper,1501
1502,"Jul 18, 2018 at 14:20 ",https://d32r1sh890xpii.cloudfront.net/article/270x200/33ac379d468c77a2e2a6a4520e1ad1fb.jpg,https://oilprice.com/Energy/Energy-General/The-Permian-Rush-Is-Creating-A-Frac-Sand-Shortage.html,"The ‘mega-frac’ is turning the typically annoying sand of West Texas into the new gold, and the oil and gas land rush on the Permian Basin has now extended into…",The Permian Rush Is Creating A Frac Sand Shortage,1502
1503,"Jul 18, 2018 at 12:08 ",https://d32r1sh890xpii.cloudfront.net/article/270x200/4716e7e0516c39dfb03752a48cdec9e3.jpg,https://oilprice.com/Energy/Energy-General/The-Last-Oil-Gas-Frontier-Is-Facing-Major-Challenges.html,"Upon hearing Papua New Guinea, very few us associate it with LNG – some might recall that it is one of the most heterogenous nations of our planets with more…",The Last Oil & Gas Frontier Is Facing Major Challenges,1503
1504,"Jul 18, 2018 at 11:47 ",https://d32r1sh890xpii.cloudfront.net/article/270x200/1920b928184755114ea7b2d128840ae5.jpg,https://oilprice.com/Energy/Energy-General/Houston-To-Get-Its-Own-Crude-Oil-Futures-As-US-Exports-Rise.html,"Intercontinental Exchange plans to launch later this quarter a crude oil futures contract of physically delivered Permian West Texas Intermediate (WTI), deliverable in Houston, as the city has become…",Houston To Get Its Own Crude Oil Futures As U.S. Exports Rise,1504
1505,"Jul 18, 2018 at 11:00 ",https://d32r1sh890xpii.cloudfront.net/article/270x200/abe0db6d770b11c3b1ef3f40366768bc.jpg,https://oilprice.com/Energy/Energy-General/Who-Actually-Benefits-From-Sanctions-On-Iran.html,"Since President Trump announced the U.S. withdrawal from the JCPOA, Washington has been pressing allies to end all imports of Iranian oil by a November 4. deadline Moreover, in a…",Who Actually Benefits From Sanctions On Iran?,1505
1506,"Jul 18, 2018 at 09:45 ",https://d32r1sh890xpii.cloudfront.net/article/270x200/459d97627e7a035b05234454a75b5597.jpg,https://oilprice.com/Energy/Crude-Oil/Surprise-Crude-Oil-Build-Sends-Oil-Prices-Down.html,"The Energy Information Administration reported a surprise major build in crude oil inventories of 5.8 million barrels for the week to July 13, after a huge draw of ",Surprise Crude Oil Build Sends Oil Prices Down,1506
1507,"Jul 18, 2018 at 08:52 ",https://d32r1sh890xpii.cloudfront.net/article/270x200/a8385ea5c51ff5fd9737126df4ff8562.jpg,https://oilprice.com/Energy/Energy-General/Worlds-Biggest-Oil-Trader-Launches-Renewables-Fund.html,"The world’s biggest oil trader, Vitol, is setting up in partnership with Low Carbon a renewables fund that will invest in renewable energy assets across Europe, the companies said…",World’s Biggest Oil Trader Launches Renewables Fund,1507
1508,"Jul 17, 2018 at 12:39 ",https://d32r1sh890xpii.cloudfront.net/article/270x200/ebc30873fb2f8a74700078b2a8f38342.jpg,https://oilprice.com/Geopolitics/International/OPEC-To-Rule-Oil-Markets-Till-Peak-Demand17799.html,"OPEC will continue to play a key role in oil supply and prices in the global oil market through 2040, despite the relentless oil production in the Permian and expectations…",OPEC To Rule Oil Markets Till Peak Demand,1508
1509,"Jul 17, 2018 at 12:38 ",https://d32r1sh890xpii.cloudfront.net/article/270x200/c6a838fde00fe79febfc27756cb6ccae.jpg,https://oilprice.com/Energy/Crude-Oil/Oil-Selloff-Gives-Trump-More-Room-On-Iran.html,The Trump administration has been going back and forth over how hard it plans on pushing countries to cut their imports of Iranian oil to zero. After softening the tone…,Oil Selloff Gives Trump More Room On Iran,1509
1510,"Jul 17, 2018 at 12:32 ",https://d32r1sh890xpii.cloudfront.net/article/270x200/e9e5392dd6e916f8914dd3d1f79c5548.jpg,https://oilprice.com/Energy/Crude-Oil/Is-The-US-Overly-Dependent-On-Russian-Oil.html,"At this week’s NATO meeting in Brussels, President Trump criticized Germany’s reliance on Russian natural gas:
“Germany is totally controlled by Russia. They will be getting between 60 and 70…",Is The U.S. Overly Dependent On Russian Oil?,1510
1511,"Jul 17, 2018 at 12:29 ",https://d32r1sh890xpii.cloudfront.net/article/270x200/af07d84a6bf90fc429ddae4c0d6946ac.jpg,https://oilprice.com/Energy/Energy-General/OPEC-To-Rule-Oil-Markets-Till-Peak-Demand.html,"More than a decade ago, China overtook the U.S. as the world's biggest carbon dioxide emitter. Today, it’s going for a complete 360 with a hungry drive to beat the…",How China Will Win The Solar Race,1511
1512,"Jul 17, 2018 at 12:05 ",https://d32r1sh890xpii.cloudfront.net/article/270x200/888d46988b2beb2ac7c8247969d2a31d.jpg,https://oilprice.com/Energy/Oil-Prices/Goldman-Brent-To-Retest-80-This-Year.html,"Goldman Sachs—which has been bullish on oil for most of this year— continues to expect that Brent Crude prices could retest the $80 a barrel threshold this year, but…",Goldman: Brent To Retest $80 This Year,1512
1513,"Jul 17, 2018 at 11:49 ",https://d32r1sh890xpii.cloudfront.net/article/270x200/2d121fd496dd601a1ca3f1f27c8e83bd.jpg,https://oilprice.com/Energy/Energy-General/Is-This-The-End-Of-The-Oil-Rally17794.html,"Oil prices were mostly flat at the start of trading on Tuesday, after having posted two of the worst single-day declines over the past week.",Is This The End Of The Oil Rally?,1513
1514,"Jul 17, 2018 at 11:26 ",https://d32r1sh890xpii.cloudfront.net/article/270x200/879fe4e407f97a770bd86330db7b25b2.jpg,https://oilprice.com/Energy/Crude-Oil/Why-Is-Venezuela-Still-Sending-Subsidized-Oil-To-Cuba.html,"In the past, oil has accounted for 96 percent of Venezuela's exports and over 40 percent of government revenues. Now, as the nation’s economy continues to crumble amid sanctions, political…",Why Is Venezuela Still Sending Subsidized Oil To Cuba?,1514
1515,"Jul 17, 2018 at 10:12 ",https://d32r1sh890xpii.cloudfront.net/article/270x200/1cc194795f9eb7a59377f10868e3dcb2.jpg,https://oilprice.com/Energy/Natural-Gas/Trumps-European-Gas-Plans-Arent-Realistic.html,"In the much-heralded meeting yesterday between President Donald Trump and Russian President Vladimir Putin in Helsinki, Trump said that the U.S. will “compete successfully” against Russia in Europe’s natural…",Trump’s European Gas Plans Aren’t Realistic,1515
1516,"Jul 17, 2018 at 08:28 ",https://d32r1sh890xpii.cloudfront.net/article/270x200/597a7be56fee4e38c6da2a143218624b.jpg,https://oilprice.com/Energy/Natural-Gas/Putin-Assures-Trump-Russia-Will-Keep-Ukraine-Gas-Transit.html,"Russian President Vladimir Putin has assured U.S. President Donald Trump that Moscow will keep the transit route of natural gas to Europe via Ukraine, Russia’s president said at the…",Putin Assures Trump: Russia Will Keep Ukraine Gas Transit,1516
1517,"Jul 16, 2018 at 14:47 ",https://d32r1sh890xpii.cloudfront.net/article/270x200/422b88d2faa071d09380e277a394e9a1.jpg,https://oilprice.com/Energy/Gas-Prices/Trumps-Ultimate-Move-To-Lower-Gasoline-Prices.html,"President Trump is reportedly considering tapping the strategic petroleum reserve to lower gasoline prices in an effort to neuter a political threat ahead of key midterm elections in November.
Sources…",Trump’s Ultimate Move To Lower Gasoline Prices,1517
1518,"Jul 16, 2018 at 14:46 ",https://d32r1sh890xpii.cloudfront.net/article/270x200/a104c527d0e2536052878b01c68d7883.jpg,https://oilprice.com/Energy/Oil-Prices/The-Best-And-Worst-Oil-Price-Predictions.html,"There is only one sure thing when it comes to oil price forecasting—forecasts will inevitably prove to be wrong.
If it’s not too high, it’s certainly too low—at any rate,…",The Best And Worst Oil Price Predictions,1518
1519,"Jul 16, 2018 at 14:16 ",https://d32r1sh890xpii.cloudfront.net/article/270x200/caac396611a2e8881111725025bc2897.jpg,https://oilprice.com/Geopolitics/International/Domestic-Unrest-Threatens-OPECs-No2.html,"Iraq’s future is again tottering with protests erupting of the country. Baghdad is being confronted by internal unrest, as economic and social problems have spilled over into the political arena.…",Domestic Unrest Threatens OPEC’s No.2,1519
1520,"Jul 16, 2018 at 13:53 ",https://d32r1sh890xpii.cloudfront.net/article/270x200/e51c9f7979a9e6a434adc10b81c4ae0d.jpg,https://oilprice.com/Energy/Natural-Gas/Gazproms-Next-Giant-Gas-Field.html,"Russian gas giant Gazprom is doubling down on the vast natural gas reserves on and offshore the Yamal peninsula, an Arctic lowland region in northwestern Siberia.
The Yamal peninsula is…",Gazprom’s Next Giant Gas Field,1520
1521,"Jul 16, 2018 at 13:22 ",https://d32r1sh890xpii.cloudfront.net/article/270x200/8d355243a25b7ea798b337c309d42db8.jpg,https://oilprice.com/Energy/Natural-Gas/Yamal-LNG-Is-Conquering-China.html,"Russia’s energy ties to China have been discussed at length throughout our website – the construction of the 38 BCm per year Power of Siberia gas pipeline, seaborne sales of…",Yamal LNG Is Conquering China,1521
1522,"Jul 16, 2018 at 13:19 ",https://d32r1sh890xpii.cloudfront.net/article/270x200/8b6494ab4eaaeea8403b9de4ea4334c3.jpg,https://oilprice.com/Energy/Energy-General/Exxons-Papua-New-Guinea-Gas-Project-Is-Dead-In-The-Water.html,"As liquefied natural gas (LNG) markets mature, trying to establish itself against decades of crude oil dominance, developments far removed from most of the action are taking unusual turns that…",Exxon’s Papua New Guinea Gas Project Is Dead In The Water,1522
1523,"Jul 16, 2018 at 11:35 ",https://d32r1sh890xpii.cloudfront.net/article/270x200/d9d93f4a33aa479fc968ffc093539cbb.jpg,https://oilprice.com/Alternative-Energy/Biofuels/US-Poised-To-Ease-Biofuel-Quotas.html,"Just as scientists are making leaps and bounds in the technology behind biofuel production, opening the way for cheaper and more efficient clean fuel sources, the United States’ Environmental Protection…",U.S. Poised To Ease Biofuel Quotas,1523
1524,"Jul 16, 2018 at 10:39 ",https://d32r1sh890xpii.cloudfront.net/article/270x200/d53fb85b9c3fc6ea789c07fc769ff45f.jpg,https://oilprice.com/Energy/Oil-Prices/Oil-Slides-As-Saudis-Gear-Up-To-Pump-Record-Volume.html,"Saudi Arabia is offering extra oil on top of its contractual volumes to some buyers in its key market Asia, as OPEC’s largest producer boosts oil production to keep markets…",Oil Slides As Saudis Gear Up To Pump Record Volume,1524
1525,"Jul 16, 2018 at 09:16 ",https://d32r1sh890xpii.cloudfront.net/article/270x200/93ef453cbe8b18f4348b6a1d2ef47505.jpg,https://oilprice.com/Energy/Crude-Oil/Wood-Mackenzie-Global-Peak-Oil-Demand-Expected-In-2036.html,"Peak oil demand is expected to come around 2036 as electric vehicles and autonomous vehicles are expected to play an increasingly important role in the world’s transportation sector, the Financial…",Wood Mackenzie: Global Peak Oil Demand Expected In 2036,1525
1526,"Jul 13, 2018 at 13:18 ",https://d32r1sh890xpii.cloudfront.net/article/270x200/365a236c6758c85dfb779ab86222dacf.jpg,https://oilprice.com/Energy/Crude-Oil/Chinese-Oil-Demand-Growth-Could-Slow-Down-Soon.html,"Oil demand growth in the world’s biggest oil importer—China—is at risk of slowing down, at least in the coming months.
 
Higher oil prices play a role in this, but…",Chinese Oil Demand Growth Could Slow Down Soon,1526
1527,"Jul 13, 2018 at 13:15 ",https://d32r1sh890xpii.cloudfront.net/article/270x200/6179899029d4030e536d97e738a23680.jpg,https://oilprice.com/Energy/Crude-Oil/Record-Oil-Production-Doesnt-Free-US-From-Global-Market.html,"In the first week of July, U.S. net imports of petroleum products fell to just 1.670 million barrels per day (mb/d), the lowest weekly total on record in at…",Record Oil Production Doesn’t Free U.S. From Global Market,1527
1528,"Jul 13, 2018 at 13:12 ",https://d32r1sh890xpii.cloudfront.net/article/270x200/eb84b7ee6d6e4ea56289cebe1cc0eb86.jpg,https://oilprice.com/Alternative-Energy/Renewable-Energy/Are-Bionic-Cells-The-Future-Of-Solar.html,"A common bacterium that lives in the human gut and can sometimes cause nasty stomach upsets can be used for good, scientists from the University of British Columbia have discovered.…",Are Bionic Cells The Future Of Solar?,1528
1529,"Jul 13, 2018 at 13:09 ",https://d32r1sh890xpii.cloudfront.net/article/270x200/8f2cd6a1b842ebea5d6e3943e9ea949d.jpg,https://oilprice.com/Alternative-Energy/Nuclear-Power/Why-Nuclear-Energy-Is-Critical-For-Russia.html,"As the world’s largest natural gas and oil producer and exporter, Russia plays an important role in setting the global geopolitical agenda. The recent agreement with OPEC is evidence of…",Why Nuclear Energy Is Critical For Russia,1529
1530,"Jul 13, 2018 at 13:06 ",https://d32r1sh890xpii.cloudfront.net/article/270x200/761feda4e85f657d15177db2bcae9f5a.jpg,https://oilprice.com/Energy/Energy-General/Housing-Prices-Soar-As-Oil-Boom-Escalates.html,"Diogenes the Cynic was once asked by one of his students whether a man should buy or rent. His reply was typical Diogenes, but still unexpected, ""Whichever he chooses, he…",Housing Prices Soar As Oil Boom Escalates,1530
1531,"Jul 13, 2018 at 13:03 ",https://d32r1sh890xpii.cloudfront.net/article/270x200/986298d14bedb701c616b2d8b462210e.jpg,https://oilprice.com/Energy/Crude-Oil/Is-The-Oil-Industry-Repeating-A-Critical-Error.html,"Ten years ago this week—July 11, 2008 to be exact—the price of a barrel of oil on the New York Mercantile Exchange hit an intraday high of $147.27, its highest…",Is The Oil Industry Repeating A Critical Error,1531
1532,"Jul 13, 2018 at 13:01 ",https://d32r1sh890xpii.cloudfront.net/article/270x200/3d2e3a9432f8d9f171cea8a48505736c.jpg,https://oilprice.com/Energy/Crude-Oil/Russia-Oil-Producers-Will-Act-If-Market-Deficit-Emerges.html,"Should supply disruptions in Venezuela and Libya lead to a deficit on the oil market, OPEC and its Russia-led non-OPEC partners will act to ensure enough supply, Russia’s Energy…",Russia: Oil Producers Will Act If Market Deficit Emerges,1532
1533,"Jul 13, 2018 at 13:01 ",https://d32r1sh890xpii.cloudfront.net/article/270x200/cd7bffae4544dd6bdb4f221bd0e008c9.jpg,https://oilprice.com/Geopolitics/International/Will-Bulgaria-Become-Europes-Next-Gas-Hub.html,"German support for Russia’s plans to double the capacity of the Nord Stream natural gas pipeline under the Baltic Sea has, in turn, encouraged Bulgaria’s aspirations to develop a regional…",Will Bulgaria Become Europe’s Next Gas Hub?,1533
1534,"Jul 13, 2018 at 13:01 ",https://d32r1sh890xpii.cloudfront.net/article/270x200/876f8c31af9d1d0a7aa81a6f18440c3d.jpg,https://oilprice.com/Alternative-Energy/Nuclear-Power/Uzbekistan-Russia-Announce-Joint-Nuclear-Facility.html,"Uzbekistan has said it has reached an agreement with Russia to jointly build a nuclear power plant, a development it says will help it economize on gas and coal.
Opponents…","Uzbekistan, Russia Announce Joint Nuclear Facility",1534
1535,"Jul 13, 2018 at 12:24 ",https://d32r1sh890xpii.cloudfront.net/article/270x200/4a3676e0221d38539a674bf5cda2d0ce.jpg,https://oilprice.com/Energy/Energy-General/Record-Oil-Production-Wont-Free-The-US-From-Global-Markets.html,"In the first week of July, U.S. net imports of petroleum products fell to just 1.670 million barrels per day (mb/d), the lowest weekly total on record in at…",Record Oil Production Won’t Free The U.S. From Global Markets,1535
1536,"Jul 13, 2018 at 12:22 ",https://d32r1sh890xpii.cloudfront.net/article/270x200/614d24e64aec946ed7d9a00c67a3bf34.jpg,https://oilprice.com/Energy/Energy-General/A-Long-Term-Play-In-Oil-Markets.html,For those that follow energy markets it is often easy to lose sight of the timescale off which the major companies in the sector make their decisions. We tend to…,A Long-Term Play In Oil Markets,1536
1537,"Jul 13, 2018 at 12:18 ",https://d32r1sh890xpii.cloudfront.net/article/270x200/08c794af83cd40fbdccfc239761574d8.jpg,https://oilprice.com/Energy/Energy-General/How-Higher-Oil-Prices-Are-Hurting-Demand.html,"Friday July 13, 2018
In the latest edition of the Numbers Report, we’ll take a look at some of the most interesting figures put out this week in the energy…",How Higher Oil Prices Are Hurting Demand,1537
1538,"Jul 13, 2018 at 12:06 ",https://d32r1sh890xpii.cloudfront.net/article/270x200/f3d2a48e7c31c15ff62d90a4525dfca1.jpg,https://oilprice.com/Energy/Energy-General/Global-Energy-Advisory-13th-July-2018.html,"U.S. LNG producers are racing to add production capacity amid forecasts for strong growth in demand, with the total—concentrated in Louisiana and Texas—set to reach 10 billion cubic feet daily…","Global Energy Advisory - 13th July, 2018",1538
1539,"Jul 13, 2018 at 12:06 ",https://d32r1sh890xpii.cloudfront.net/article/270x200/122c0adb8761521945fbccb2dd1b14b2.jpg,https://oilprice.com/Energy/Energy-General/Technical-Analysis-Was-This-Just-A-Correction.html,"U.S. West Texas Intermediate crude oil plunged earlier in the week on worries that escalating trade tensions between the United States and China could hurt oil demand, and news that…",Technical Analysis: Was This Just A Correction?,1539
1540,"Jul 13, 2018 at 12:36 ",https://d32r1sh890xpii.cloudfront.net/article/270x200/3105e10985f4944bc8b15a7638fb99b5.jpg,https://oilprice.com/Energy/Energy-General/Oil-Retraces-Libyan-Production-Surge.html,"The oil market took a beating this week, with the return of Libyan supply weighing on crude prices.
(Click to enlarge)",Oil Retraces On Libyan Production Surge,1540
1541,"Jul 13, 2018 at 12:34 ",https://d32r1sh890xpii.cloudfront.net/article/270x200/c3ce55e680100b3b2c39c18ca1801489.jpg,https://oilprice.com/Metals/Commodities/This-Year-Everyone-Will-Love-Uranium.html,"Copper prices are up 60 percent in 24 months and zinc has gained 140 percent in two years. Gold is up too, 20 percent in two years. But one of…","This Year, Everyone Will Love Uranium",1541
1542,"Jul 13, 2018 at 12:25 ",https://d32r1sh890xpii.cloudfront.net/article/270x200/88bd54f94681e80228da49d84e252d99.jpg,https://oilprice.com/Energy/Energy-General/US-Canadian-Rig-Count-Rises-After-Tumultuous-Week.html,"Baker Hughes reported an increase to the number of active oil and gas rigs in the United States on Friday. Oil and gas rigs increased by 2 rigs, according…","U.S., Canadian Rig Count Rises After Tumultuous Week",1542
1543,"Jul 13, 2018 at 09:35 ",https://d32r1sh890xpii.cloudfront.net/article/270x200/5ffefa0a3162f8ee0e7947ff40cf9d44.jpg,https://oilprice.com/Energy/Energy-General/US-To-Hold-Major-Oil-Gas-Lease-Sale-In-August.html,"The U.S. Department of the Interior will hold an oil and gas lease sale for 78 million acres in the Gulf of Mexico on August 15, the department said in…",U.S. To Hold Major Oil & Gas Lease Sale In August,1543
1544,"Jul 13, 2018 at 08:59 ",https://d32r1sh890xpii.cloudfront.net/article/270x200/76f4b5808a619b25195edc29f13b4b3a.jpg,https://oilprice.com/Energy/Crude-Oil/Iraq-Set-To-Boost-Oil-Output-After-Bai-Hassan-Restart.html,Satellite surveillance shows that production has fully resumed at the Bai Hassan field in Iraq. The field is part of a complex of oilfields in Northern Iraq that were shut…,Iraq Set To Boost Oil Output After Bai Hassan Restart,1544
1545,"Jul 12, 2018 at 16:43 ",https://d32r1sh890xpii.cloudfront.net/article/270x200/819be81324407a4ea4a31ef01258f771.jpg,https://oilprice.com/Energy/Energy-General/This-Oil-Price-Crash-Was-Just-A-Correction.html,"The oil market is “stretched to the limit” despite the fact that OPEC+ agreed to ramp up production following their meeting last month, according to the International Energy Agency.
The…",This Oil Price Crash Was Just A Correction,1545
1546,"Jul 12, 2018 at 16:36 ",https://d32r1sh890xpii.cloudfront.net/article/270x200/b0e2ab1604fe2fd1b8eedd90be88796c.jpg,https://oilprice.com/Energy/Energy-General/The-Permian-Banks-On-These-Key-Pipelines.html,Booming crude oil and natural gas production in the Permian Basin and not enough pipeline takeaway capacity have widened the discounts at which oil and natural gas pumped in the…,The Permian Banks On These Key Pipelines,1546
